{"analysis_summary":{"breaking_changes_detected":false,"highest_severity":"MINOR","total_files":2},"baseline_commit":null,"branch":"main","breaking_changes":[],"commit_sha":"f6d540ed59e9617466d52b7477b35e68a11d83b7","deterministic":true,"meta":{"generated_at":"2024-01-01T05:30:00","tool_version":"1.0.0"},"project_id":"nested_router","report":{"affected_packages":["api","express"],"analysis_summary":{"breaking_changes_detected":false,"highest_severity":"MINOR","severity_distribution":{"MAJOR":0,"MINOR":1,"PATCH":1},"total_files":2,"total_files_analyzed":2},"api_contract":{"endpoints":[]},"api_summary":{"added":0,"modified":0,"removed":0},"api_surface":[],"architecture":{"external_dependencies":[],"layers":[],"pattern":"modular monolith"},"architecture_insights":{"dependency_insights":{"circular_dependencies":[],"high_fan_in_modules":[],"unstable_modules":["app"]},"layer_violations":[],"module_centrality":[],"tightly_coupled_modules":[]},"architecture_reconstruction":{"components":[],"edges":[],"layers":[],"pattern":"Layered Architecture"},"breaking_change_details":[],"call_graph":[],"call_graph_analysis":{"dead_functions":[],"entry_points":[],"execution_paths":[],"max_call_depth":0},"change_complexity_score":0.2,"change_summary":"fixture","changes":[{"change_type":"ADDED","component":"backend","features":{"api_endpoints":[],"classes":[],"dependencies":["./api","express"],"exported_classes":[],"exported_functions":[],"functions":[],"hooks":[],"react_components":[]},"file":"app.js","schema_tags":[],"severity":"PATCH"},{"change_type":"ADDED","component":"backend","features":{},"file":"package.json","schema_tags":[],"severity":"MINOR"}],"code_intelligence":{"call_graph":{"edges":[],"nodes":[]},"dependency_graph":{"circular_dependencies":[],"cycle_detected":false,"dependencies":[],"modules":["app"]},"repository_graph":{"edges":[],"nodes":[{"id":"app","type":"module"}]},"symbol_index":[]},"context":{"author":"Deterministic Bot","author_email":"deterministic@example.com","branch":"main","commit_sha":"f6d540ed59e9617466d52b7477b35e68a11d83b7","commit_timestamp":"2024-01-01T05:30:00","full_sha":"f6d540ed59e9617466d52b7477b35e68a11d83b7","generated_at":"2024-01-01T05:30:00","repository":"nested_router"},"corrected_call_graph":{"execution_paths":[],"true_entry_points":[]},"data_model":{"entities":[],"relationships":[]},"database_impact":{"model_count":0,"models":[],"schema_changed":false,"tables_affected":[]},"dead_function_analysis":{"count":0,"true_dead_functions":[]},"dependency_analysis":{"core_modules":[],"cycles":[],"graph_metrics":{"max_dependency_depth":1,"node_metrics":{"./api":{"centrality":0.33,"fan_in":1,"fan_out":0,"instability":0.0},"app":{"centrality":0.67,"fan_in":0,"fan_out":2,"instability":1.0},"express":{"centrality":0.33,"fan_in":1,"fan_out":0,"instability":0.0},"package.json":{"centrality":0.0,"fan_in":0,"fan_out":0,"instability":0.0}}},"high_coupling_modules":[]},"dependency_classification":{"dev_dependencies":[],"external_dependencies":["api","express"],"internal_modules":[],"static_assets":[]},"dependency_graph":{"analysis":{"cycle_detected":false,"cycles":[]},"edges":[{"from":"app","to":"./api","type":"external"},{"from":"app","to":"express","type":"external"}],"nodes":[{"id":"./api","type":"internal_module"},{"id":"app","type":"internal_module"},{"id":"express","type":"external_package"},{"id":"package.json","type":"external_package"}]},"doc_contract":{"requires_adr":false,"requires_api_reference":true,"requires_architecture_doc":true,"requires_readme":true},"documentation_contract":{"requires_adr":false,"requires_api_reference":true,"requires_architecture_doc":true,"requires_readme":true},"files":[{"change_type":"ADDED","component":"backend","features":{"api_endpoints":[],"classes":[],"dependencies":["./api","express"],"exported_classes":[],"exported_functions":[],"functions":[],"hooks":[],"react_components":[]},"path":"app.js","severity":"PATCH"},{"change_type":"ADDED","component":"backend","features":{},"path":"package.json","severity":"MINOR"}],"impact_analysis":{"impact_analysis":{"affected_components":[],"blast_radius":1,"changed_components":["app"],"metrics":{"api_changes":0,"call_chain_depth":0,"db_changes":0,"module_changes":1},"risk_score":2.0,"severity":"MINOR"}},"impact_propagation":{"affected_callers":[],"affected_modules":["./api","app","express","package.json"],"blast_radius":4,"changed_files":[{"change_type":"ADDED","component":"backend","features":{"api_endpoints":[],"classes":[],"dependencies":["./api","express"],"exported_classes":[],"exported_functions":[],"functions":[],"hooks":[],"react_components":[]},"file":"app.js","schema_tags":[],"severity":"PATCH"},{"change_type":"ADDED","component":"backend","features":{},"file":"package.json","schema_tags":[],"severity":"MINOR"}]},"infra_analysis":{"ci_workflow":null,"docker":false},"quality_warnings":["QUALITY_WARNING: endpoint_count=0 (no API endpoints detected)","QUALITY_WARNING: endpoint_count=0 (no API endpoints detected)"],"repository_evidence":{"api_mounts":[{"base_path":"/api","router":"api.js"},{"base_path":"/projects","router":"projects.js"}],"apis":[],"components":[{"files":["app.js"],"framework":"express","name":"app","path":"","type":"backend_module"}],"entities":[],"file_evidence":{"app.js":{"api_endpoints":[],"classes":[],"dependencies":["./api","express"],"exported_classes":[],"exported_functions":[],"functions":[],"hooks":[],"react_components":[]},"package.json":{}},"frontend_routes":[],"modules":[{"files":["app.js"],"framework":"express","name":"app","path":"","type":"backend_module"}],"mounts":[{"line":0,"mount_path":"/api","mounted_router":"api","parent":"__root__","path":"/api","router":"api","router_file":"api.js","source_file":"app.js"},{"line":0,"mount_path":"/projects","mounted_router":"projects","parent":"api","path":"/projects","router":"projects","router_file":"projects.js","source_file":"api.js"}],"quality_warnings":["QUALITY_WARNING: endpoint_count=0 (no API endpoints detected)"],"relationships":[],"repositories":[],"routers":[],"services":[],"tech_stack":{"backend":["express"],"database":[],"frontend":[],"infrastructure":[]}},"repository_type":"backend-service","risk_analysis":{"blast_radius":"LOCAL","migration_required":false,"operational_risk":"LOW","test_scope":["unit"]},"schema_analysis":{"models":[],"models_detected":0,"relationships":[]},"search_index":{"apis":[],"modules":[{"dependencies":["./api","express"],"file":"app.js","name":"app","type":"backend"}],"references":[],"symbols":[]},"summary":"Analyzed 2 files: 0 endpoints, 0 breaking changes, stack=express","tech_stack":{"backend_framework":"express","ci":[],"database":null,"frontend_framework":null,"infra":[],"orm":null}},"schema_version":"epic1-impact/v3","severity":"PATCH","statistics":{"major":0,"minor":0,"patch":0,"total_changes":0},"status":"success","version":"1.0.0"}