{"analysis_summary":{"breaking_changes_detected":false,"highest_severity":"PATCH","total_files":2},"baseline_commit":null,"branch":"main","breaking_changes":[],"commit_sha":"84c2190f2b62262be663d3f4e7557313f1fee368","deterministic":true,"meta":{"tool_version":"1.0.0"},"project_id":"Deterministic Bot/non_express_fastapi","report":{"affected_packages":["fastapi"],"analysis_summary":{"breaking_changes_detected":false,"highest_severity":"PATCH","total_files":2},"api_contract":{"endpoints":[]},"api_summary":{"added":0,"modified":0,"removed":0},"api_surface":[],"architecture":{"external_dependencies":[],"layers":[],"pattern":"modular-monolith"},"breaking_change_details":[],"change_complexity_score":0.09,"change_summary":"fixture.","changes":[{"change_type":"ADDED","component":"other","features":{"api_endpoints":[],"api_routes":[],"classes":[],"comments":[],"complexity_nodes":0,"decorators":["@app.get('/users/{user_id}')"],"docstrings":[],"functions":["get_user"],"imports":["from fastapi import FastAPI"]},"file":"main.py","is_binary":false,"language":"python","severity":"PATCH","syntax_error":false},{"change_type":"ADDED","component":"other","features":{"api_endpoints":[]},"file":"requirements.txt","is_binary":false,"language":null,"severity":"PATCH","syntax_error":false}],"component_distribution":{"other":2},"configuration_changes":{"build_files":["requirements.txt"],"docker":false,"environment_variables":[]},"context":{"author":"Deterministic Bot","author_email":"deterministic@example.com","branch":"main","commit_sha":"84c2190f","full_sha":"84c2190f2b62262be663d3f4e7557313f1fee368","intent":{"message":"fixture"},"repository":"non_express_fastapi","stats":{"is_first_commit":true,"total_commits":1}},"data_model":{"entities":[],"relationships":[]},"database_impact":{"schema_changed":false,"tables_affected":[]},"doc_contract":{"adr_contract":{"consequences_negative":["Requires maintaining richer extraction logic"],"consequences_positive":["Downstream documentation generation is deterministic","Reduces guesswork in API and architecture docs"],"context":"fixture.","decision_title":"Internal Only Documentation Update","followups":[],"options_considered":["Document only changed files","Publish full EPIC-2 contract set"],"selected_option":"Publish full EPIC-2 contract set","status":"proposed"},"api_contract":{"endpoints":[]},"architecture_contract":{"components":[{"name":"other","responsibility":"Owns other related behavior in this change set","type":"service"}],"data_stores":[],"entities":[],"external_integrations":[],"interactions":[],"sequence_steps":[{"action":"Send API request","actor":"client","target":"http-endpoint"},{"action":"Validate/authenticate request","actor":"backend","target":"middleware"},{"action":"Execute handler logic","actor":"backend","target":"service/data-store"},{"action":"Return HTTP response","actor":"backend","target":"client"}]},"quality_contract":{"extraction_quality":{"api_endpoint_count":0,"invalid_endpoint_count":0,"warnings":[]},"risk_register":[],"security_impact":{"auth_changes":false,"crypto_changes":false,"sensitive_paths":[]},"test_impact":{"impacted_areas":["other"],"requires_new_tests":false}},"readme_contract":{"changed_components":["other"],"deployment_notes":["Build pipeline or package manifests changed"],"key_features":["Deployment"],"project_summary":"fixture.","risk_highlights":[]}},"documentation_contract":{"requires_adr":false,"requires_api_reference":true,"requires_architecture_doc":true,"requires_readme":true},"documentation_impact":{"adr_required":false,"api_docs":false,"architecture":false,"readme":false},"extraction_quality":{"api_endpoint_count":0,"invalid_endpoint_count":0,"normalized_endpoint_count":0,"warnings":[]},"feature_tags":["Deployment"],"guardrails":{"applied":[],"limits":{"max_file_bytes":1048576,"max_files":12000,"max_total_parse_bytes":262144000}},"impact_scope":"INTERNAL_ONLY","indexing":{"format":"SCIP","symbol_count":1},"intent_classification":"BUGFIX","repository_type":"backend-service","security_features_detected":[],"serialization":{"format":"protobuf","total_payload_bytes":476},"symbol_graph":{"edges":[{"edge_type":"imports","source_symbol_id":"5fa098af27c14e4fa6ded892bc63a8f828b5630cfb736733d41439c41a4086b0","target_symbol_id":"a21408ce88d98d17c8e189c43b9ce1df937e7edc1807736b21a0c89abac8ec62"}],"nodes":{"5fa098af27c14e4fa6ded892bc63a8f828b5630cfb736733d41439c41a4086b0":{"file_path":"main.py","id":"5fa098af27c14e4fa6ded892bc63a8f828b5630cfb736733d41439c41a4086b0","kind":"function","metadata":{"language":"python","module":true},"name":"main.py#module","signature_hash":"d122200058cdfb256bbe94bab641b817ceaf185ddcd4e64815173100ce3e0754","visibility":"public"},"972b9146e7d43482d15dac059168bf969fcd729768f26e85db438f855291372f":{"file_path":"main.py","id":"972b9146e7d43482d15dac059168bf969fcd729768f26e85db438f855291372f","kind":"function","metadata":{"declared_in":"functions","language":"python"},"name":"get_user","signature_hash":"93137b475ea629d359f984d13ac3ad90744ede078f05be4179ac93238a97422e","visibility":"public"},"a21408ce88d98d17c8e189c43b9ce1df937e7edc1807736b21a0c89abac8ec62":{"file_path":"__import__/from fastapi import FastAPI","id":"a21408ce88d98d17c8e189c43b9ce1df937e7edc1807736b21a0c89abac8ec62","kind":"interface","metadata":{"external":true},"name":"from fastapi import FastAPI","signature_hash":"0bfa36b946dc0d8da178b371df77f8945be5ca4c2bdade774bf54cb643a9ca4c","visibility":"public"},"e8e63840807a3ec4d3702a22908db5f94a516e711bdf621e685be9b41e2cec5b":{"file_path":"requirements.txt","id":"e8e63840807a3ec4d3702a22908db5f94a516e711bdf621e685be9b41e2cec5b","kind":"function","metadata":{"language":"","module":true},"name":"requirements.txt#module","signature_hash":"f6daa9e9686456b96811359b360ac95ff3d96fa838b0755053dd598f53206f50","visibility":"public"}}},"symbol_summary":{"breaking_symbols":0,"risk_score_total":0,"total_edges":1,"total_symbols":4},"tech_stack":{"backend_framework":"fastapi","ci":[],"database":null,"frontend_framework":null,"infra":[],"orm":null},"test_impact":{"requires_new_tests":[],"test_files_changed":0}},"schema_version":"epic1-impact/v3","severity":"PATCH","statistics":{"major":0,"minor":0,"patch":2,"total_changes":2},"status":"success","version":"2.0"}