{"analysis_summary":{"breaking_changes_detected":false,"highest_severity":"MAJOR","total_files":2},"baseline_commit":null,"branch":"main","breaking_changes":[],"commit_sha":"e0153b1b93767d53cbc1d4a6962081faec46e1e8","deterministic":true,"meta":{"generated_at":"2024-01-01T05:30:00","tool_version":"1.0.0"},"project_id":"express_small","report":{"affected_packages":["express"],"analysis_summary":{"breaking_changes_detected":false,"highest_severity":"MAJOR","severity_distribution":{"MAJOR":1,"MINOR":1,"PATCH":0},"total_files":2,"total_files_analyzed":2},"api_contract":{"endpoints":[{"auth":{"required":false,"type":"unknown"},"component":"server","confidence":0.8,"controller":"server.inlineHandler","description":"","endpoint_hash":"ddd0accc78fa77779c28c733cdfe7c99acf9101a759f06f21f4941673070fa0b","example":{},"line":5,"method":"GET","normalized_key":"get /api/users/:id","operation_id":"getApiUsersId","path":"/api/users/:id","request":{"body_schema":null,"headers":[],"path_params":[],"query_params":[]},"responses":[],"router_file":"server.js","source":{"controller":"server.inlineHandler"},"source_file":"server.js","summary":"","tags":["server"],"warnings":[]},{"auth":{"required":false,"type":"unknown"},"component":"server","confidence":0.8,"controller":"server.inlineHandler","description":"","endpoint_hash":"d6a0b5f106031a00bdedc0e977aa7005d121e47b1354446fe1371823a67ee084","example":{},"line":6,"method":"POST","normalized_key":"post /api/users","operation_id":"postApiUsers","path":"/api/users","request":{"body_schema":null,"headers":[],"path_params":[],"query_params":[]},"responses":[],"router_file":"server.js","source":{"controller":"server.inlineHandler"},"source_file":"server.js","summary":"","tags":["server"],"warnings":[]}]},"api_summary":{"added":0,"modified":0,"removed":0},"api_surface":[{"auth_required":false,"controller":"server.inlineHandler","method":"GET","path":"/api/users/{id}","request_schema_hash":"456e42238c3721627d129a5d6aa2a6ccdf2a2462f31a6b6901ddc01d24538d90","response_schema_hash":"4f53cda18c2baa0c0354bb5f9a3ecbe5ed12ab4d8e11ba873c2f11161202b945"},{"auth_required":false,"controller":"server.inlineHandler","method":"POST","path":"/api/users","request_schema_hash":"456e42238c3721627d129a5d6aa2a6ccdf2a2462f31a6b6901ddc01d24538d90","response_schema_hash":"4f53cda18c2baa0c0354bb5f9a3ecbe5ed12ab4d8e11ba873c2f11161202b945"}],"architecture":{"external_dependencies":[],"layers":[],"pattern":"modular monolith"},"architecture_insights":{"dependency_insights":{"circular_dependencies":[],"high_fan_in_modules":[],"unstable_modules":["server"]},"layer_violations":[],"module_centrality":[],"tightly_coupled_modules":[]},"architecture_reconstruction":{"components":[{"id":"router","layer":"presentation","type":"router"}],"edges":[],"layers":["presentation"],"pattern":"Layered Architecture"},"breaking_change_details":[],"call_graph":[],"call_graph_analysis":{"dead_functions":[],"entry_points":[],"execution_paths":[],"max_call_depth":0},"change_complexity_score":0.2,"change_summary":"fixture","changes":[{"change_type":"ADDED","component":"backend","features":{},"file":"package.json","schema_tags":[],"severity":"MINOR"},{"change_type":"ADDED","component":"backend","features":{"api_endpoints":[{"line":5,"route":"/users/:id","verb":"GET"},{"line":6,"route":"/users","verb":"POST"}],"classes":[],"dependencies":["express"],"exported_classes":[],"exported_functions":[],"functions":[],"hooks":[],"react_components":[]},"file":"server.js","schema_tags":[],"severity":"MAJOR"}],"code_intelligence":{"call_graph":{"edges":[],"nodes":[]},"dependency_graph":{"circular_dependencies":[],"cycle_detected":false,"dependencies":[],"modules":["server"]},"repository_graph":{"edges":[{"from":"GET /api/users/:id","to":"server","type":"calls"},{"from":"POST /api/users","to":"server","type":"calls"}],"nodes":[{"id":"GET /api/users/:id","type":"api"},{"id":"POST /api/users","type":"api"},{"id":"server","type":"controller"}]},"symbol_index":[{"file":"server.js","line":5,"name":"GET /api/users/:id","type":"route"},{"file":"server.js","line":6,"name":"POST /api/users","type":"route"},{"file":"server.js","line":5,"name":"server","type":"controller"}]},"context":{"author":"Deterministic Bot","author_email":"deterministic@example.com","branch":"main","commit_sha":"e0153b1b93767d53cbc1d4a6962081faec46e1e8","commit_timestamp":"2024-01-01T05:30:00","full_sha":"e0153b1b93767d53cbc1d4a6962081faec46e1e8","generated_at":"2024-01-01T05:30:00","repository":"express_small"},"corrected_call_graph":{"execution_paths":[],"true_entry_points":[]},"data_model":{"entities":[],"relationships":[]},"database_impact":{"model_count":0,"models":[],"schema_changed":false,"tables_affected":[]},"dead_function_analysis":{"count":0,"true_dead_functions":[]},"dependency_analysis":{"core_modules":[],"cycles":[],"graph_metrics":{"max_dependency_depth":1,"node_metrics":{"express":{"centrality":0.5,"fan_in":1,"fan_out":0,"instability":0.0},"package.json":{"centrality":0.0,"fan_in":0,"fan_out":0,"instability":0.0},"server":{"centrality":0.5,"fan_in":0,"fan_out":1,"instability":1.0}}},"high_coupling_modules":[]},"dependency_classification":{"dev_dependencies":[],"external_dependencies":["express"],"internal_modules":[],"static_assets":[]},"dependency_graph":{"analysis":{"cycle_detected":false,"cycles":[]},"edges":[{"from":"server","to":"express","type":"external"}],"nodes":[{"id":"express","type":"external_package"},{"id":"package.json","type":"external_package"},{"id":"server","type":"internal_module"}]},"doc_contract":{"requires_adr":false,"requires_api_reference":true,"requires_architecture_doc":true,"requires_readme":true},"documentation_contract":{"requires_adr":false,"requires_api_reference":true,"requires_architecture_doc":true,"requires_readme":true},"files":[{"change_type":"ADDED","component":"backend","features":{},"path":"package.json","severity":"MINOR"},{"change_type":"ADDED","component":"backend","features":{"api_endpoints":[{"line":5,"route":"/users/:id","verb":"GET"},{"line":6,"route":"/users","verb":"POST"}],"classes":[],"dependencies":["express"],"exported_classes":[],"exported_functions":[],"functions":[],"hooks":[],"react_components":[]},"path":"server.js","severity":"MAJOR"}],"impact_analysis":{"impact_analysis":{"affected_components":[],"blast_radius":1,"changed_components":["server"],"metrics":{"api_changes":0,"call_chain_depth":0,"db_changes":0,"module_changes":1},"risk_score":2.0,"severity":"MINOR"}},"impact_propagation":{"affected_callers":[],"affected_modules":["express","package.json","server"],"blast_radius":3,"changed_files":[{"change_type":"ADDED","component":"backend","features":{},"file":"package.json","schema_tags":[],"severity":"MINOR"},{"change_type":"ADDED","component":"backend","features":{"api_endpoints":[{"line":5,"route":"/users/:id","verb":"GET"},{"line":6,"route":"/users","verb":"POST"}],"classes":[],"dependencies":["express"],"exported_classes":[],"exported_functions":[],"functions":[],"hooks":[],"react_components":[]},"file":"server.js","schema_tags":[],"severity":"MAJOR"}]},"infra_analysis":{"ci_workflow":null,"docker":false},"quality_warnings":[],"repository_evidence":{"api_mounts":[{"base_path":"/api","router":"server.js"}],"apis":[{"controller":"server.inlineHandler","line":5,"method":"GET","module":"server","path":"/api/users/:id","router_file":"server.js","source_file":"server.js"},{"controller":"server.inlineHandler","line":6,"method":"POST","module":"server","path":"/api/users","router_file":"server.js","source_file":"server.js"}],"components":[{"files":["server.js"],"framework":"express","name":"server","path":"","type":"backend_module"}],"entities":[],"file_evidence":{"package.json":{},"server.js":{"api_endpoints":[{"line":5,"route":"/users/:id","verb":"GET"},{"line":6,"route":"/users","verb":"POST"}],"classes":[],"dependencies":["express"],"exported_classes":[],"exported_functions":[],"functions":[],"hooks":[],"react_components":[]}},"frontend_routes":[],"modules":[{"files":["server.js"],"framework":"express","name":"server","path":"","type":"backend_module"}],"mounts":[{"line":0,"mount_path":"/api","mounted_router":"router","parent":"__root__","path":"/api","router":"router","router_file":"server.js","source_file":"server.js"}],"quality_warnings":[],"relationships":[{"from":"router","to":"server","type":"router_serves_component"},{"from":"server","to":"GET /api/users/:id","type":"EXPOSES_API"},{"from":"server","to":"POST /api/users","type":"EXPOSES_API"}],"repositories":[],"routers":[{"name":"router","routes":["GET /users/:id","POST /users"],"source_file":"server.js","type":"express_router"}],"services":[],"tech_stack":{"backend":["express"],"database":[],"frontend":[],"infrastructure":[]}},"repository_type":"backend-service","risk_analysis":{"blast_radius":"LOCAL","migration_required":false,"operational_risk":"LOW","test_scope":["unit"]},"schema_analysis":{"models":[],"models_detected":0,"relationships":[]},"search_index":{"apis":[{"controller":"server","endpoint":"GET /api/users/:id","method":"GET","service":""},{"controller":"server","endpoint":"POST /api/users","method":"POST","service":""}],"modules":[{"dependencies":["express"],"file":"server.js","name":"server","type":"controller"}],"references":[{"called_by":["GET /api/users/:id","POST /api/users"],"calls":[],"symbol":"server"}],"symbols":[{"file":"server.js","line":5,"module":"server","name":"server","type":"controller"}]},"summary":"Analyzed 2 files: 2 endpoints, 0 breaking changes, stack=express","tech_stack":{"backend_framework":"express","ci":[],"database":null,"frontend_framework":null,"infra":[],"orm":null}},"schema_version":"epic1-impact/v3","severity":"PATCH","statistics":{"major":0,"minor":0,"patch":0,"total_changes":0},"status":"success","version":"1.0.0"}